"register","index","code","desc","spec_type","length","spec_values","spec_required","type","required","rules","values","decimal"
"K210","2","COD_EMP","Código de identificação da empresa participante","N","004","","Sim","int","True","['REGRA_EXISTE_EMP_COD_K100']","",""
"K210","3","COD_CTA_EMP","Código da conta da empresa participante","C","","","Sim","char","True","","",""
"K300","2","COD_CTA","Código da conta consolidada","C","","","Sim","char","True","['REGRA_EXISTE_K200_ANALITICA']","",""
"K300","3","VAL_AG","Valor absoluto aglutinado","N","019","","Sim","float","True","","","02"
"K300","4","IND_VAL_AG","Indicador da situação do valor aglutinado: D – Devedor C – Credor","C","001","[D;C]","Sim","char","True","","['D', 'C']",""
"K300","5","VAL_EL","Valor absoluto das eliminações","N","019","","Sim","float","True","['REGRA_SOMATORIO_VALOR_ELIMINACOES']","","02"
"K300","6","IND_VAL_EL","Indicador da situação do valor eliminado: D – Devedor C – Credor","C","001","[D;C]","Sim","char","True","","['D', 'C']",""
"K300","7","VAL_CS","Valor absoluto consolidado: VAL_CS = VAL_AG – VAL_EL","N","019","","Sim","float","True","['REGRA_CALCULO_VALOR_CONSOLIDADO']","","02"
"K300","8","IND_VAL_CS","Indicador da situação do valor consolidado: D – Devedor C – Credor","C","001","[D;C]","Sim","char","True","","['D', 'C']",""
"K310","2","EMP_COD_PARTE","Código da empresa detentora do valor aglutinado que foi eliminado","N","004","","Sim","int","True","['REGRA_EXISTE_EMP_COD_K100']","",""
"K310","3","VALOR","Parcela do valor eliminado total","N","019","","Sim","float","True","['REGRA_SOMATORIO_VALOR_CONTRAPARTIDA']","","02"
"K310","4","IND_VALOR","Indicador da situação do valor eliminado: D – Devedor C – Credor","C","001","[D;C]","Sim","char","True","","['D', 'C']",""
"K315","2","EMP_COD_CONTRA","Código da empresa da contrapartida","N","004","","Sim","int","True","['REGRA_EXISTE_EMP_COD_K100', 'REGRA_EMP_COD_CONTRA_DIFERENTE_EMP_COD_PARTE']","",""
"K315","3","COD_CONTRA","Código da conta consolidada da contrapartida","C","","","Sim","char","True","['REGRA_COD_CTA_DIFERENTE_COD_CONTRA', 'REGRA_EXISTE_COD_CTA_K300']","",""
"K315","4","VALOR","Parcela da contrapartida do valor eliminado total","N","019","","Sim","float","True","['REGRA_MAIOR_QUE_ZERO', 'REGRA_SOMATORIO_VALOR_CONTRAPARTIDA']","","02"
"K315","5","IND_VALOR","Indicador da situação do valor eliminado: D – Devedor C – Credor","C","001","[D;C]","Sim","char","True","","['D', 'C']",""
"K990","2","QTD_LIN_K","Quantidade total de linhas do Bloco K.","N","","","Sim","int","True","['REGRA_QRD_LIN_BLOCOK']","",""
"9001","2","IND_DAD","Indicador de movimento: 0- Bloco com dados informados; 1- Bloco sem dados informados.","N","001","[0,1]","Sim","int","True","","['0', '1']",""
"9900","2","REG_BLC","Registro que será totalizado no próximo campo.","C","4","Somente tipos de registro previstos para a escrituração contábil digital","Sim","char","True","","",""
"9900","3","QTD_REG_BLC","Total de registros do tipo informado no campo anterior.","N","","","Sim","int","True","['REGRA_QTD_REG_BLC']","",""
"9990","2","QTD_LIN_9","Quantidade total de linhas do Bloco 9.","N","","","Sim","int","True","['REGRA_QRD_LIN_BLOCO9']","",""
"9999","2","QTD_LIN","Quantidade total de linhas do arquivo digital.","N","","","Sim","int","True","['REGRA_QTD_LIN_ARQUIVO']","",""
