"Register","Page","Nº","Campo","Descrição","Tipo","Tamanho","Decimal","Valores Válidos","Obrigatório"
"W200","388","13","VL_IR_DEVIDO_EST","Imposto de Renda Devido, em moeda estrangeira (identificada no campo W100.TIP_MOEDA): Deve ser informada a soma do imposto de renda devido, em moeda estrangeira, sobre os lucros tributáveis ou prejuízos no ano fiscal de declaração de todas as entidades integrantes do grupo multinacional residentes para fins tributários na jurisdição reportada. A despesa deve refletir apenas operações realizadas no ano e não inclui impostos diferidos ou provisões para passivos tributários incertos. Observação: Esse campo deve ser preenchido somente se W100.TIP_MOEDA for diferente de Real.","NS","19","2","-","Não"
"W200","388","14","VL_IR_DEVIDO","Imposto de Renda Devido: Deve ser informada a soma do imposto de renda devido, em reais, sobre os lucros tributáveis ou prejuízos no ano fiscal de declaração de todas as entidades integrantes do grupo multinacional residentes para fins tributários na jurisdição reportada. A despesa deve refletir apenas operações realizadas no ano e não inclui impostos diferidos ou provisões para passivos tributários incertos. Observação: Caso o campo W200.VL_IR_DEVIDO_EST seja informado, este campo será calculado pelo sistema, utilizando como base para conversão tabela do Banco Central para a data de 31 de dezembro do ano da Declaração.","NS","19","2","-","Sim"
"W200","389","15","VL_CAP_SOC_EST","Capital Social em Moeda Estrangeira (identificada no campo W100.TIP_MOEDA): A entidade declarante deve reportar a soma do capital social, em moeda estrangeira, de todas as entidades integrantes residentes para fins tributários na jurisdição informada. Quanto aos estabelecimentos permanentes, o capital social deve ser reportado pela entidade à qual o estabelecimento está relacionado, a menos que exista, na jurisdição onde o estabelecimento permanente está situado, a obrigatoriedade de um capital definido, para fins regulatórios. Nesse caso, o capital atribuído a um estabelecimento permanente deve ser especificado no campo de Informações Adicionais do registro W300. Observação: Esse campo deve ser preenchido somente se W100.TIP_MOEDA for diferente de Real.","NS","19","2","-","Não"
"W200","389","16","VL_CAP_SOC","Capital Social: A entidade declarante deve reportar a soma do capital social, em reais, de todas as entidades integrantes residentes para fins tributários na jurisdição informada. Quanto aos estabelecimentos permanentes, o capital social deve ser reportado pela entidade à qual o estabelecimento está relacionado, a menos que exista, na jurisdição onde o estabelecimento permanente está situado, a obrigatoriedade de um capital definido, para fins regulatórios. Nesse caso, o capital atribuído a um estabelecimento permanente deve ser especificado no registro de Informações Adicionais do registro W300. Observação: Caso o campo W200.VL_CAP_SOC_EST seja informado, este campo será calculado pelo sistema, utilizando como base para conversão tabela do Banco Central para a data de 31 de dezembro do ano da Declaração.","NS","19","2","-","Sim"
"W200","389","17","VL_LUC_ACUM_EST","Lucros Acumulados em Moeda Estrangeira (identificada no campo W100.TIP_MOEDA): A entidade declarante deve reportar a soma do total de lucros acumulados, em moeda estrangeira, de todas as entidades integrantes do grupo multinacional residentes para fins tributários na jurisdição informada. No que diz respeito aos estabelecimentos permanentes, os lucros acumulados devem ser reportados pela entidade à qual o estabelecimento está relacionado. Observação: Esse campo deve ser preenchido somente se W100.TIP_MOEDA for diferente de Real.","NS","19","2","-","Não"
"W200","390","18","VL_LUC_ACUM","Lucros Acumulados: A entidade declarante deve reportar a soma do total de lucros acumulados, em reais, de todas as entidades integrantes do grupo multinacional residentes para fins tributários na jurisdição informada. No que diz respeito aos estabelecimentos permanentes, os lucros acumulados devem ser reportados pela entidade à qual o estabelecimento está relacionado. Observação: Caso o campo W200.LUC_ACUM_EST seja informado, este campo será calculado pelo sistema, utilizando como base para conversão tabela do Banco Central para a data de 31 de dezembro do ano da Declaração.","NS","19","2","-","Sim"
"W200","390","19","VL_ATIV_TANG_EST","Ativos Tangíveis (exceto caixa e equivalentes de caixa) em Moeda Estrangeira (identificada no campo W100.TIP_MOEDA): Deve ser informada a soma do valor contábil líquido dos ativos tangíveis, em moeda estrangeira, de todas as entidades integrantes do grupo multinacional residentes para fins tributários na jurisdição indicada. Quanto aos estabelecimentos permanentes, seus ativos devem ser reportados com referência à jurisdição na qual o estabelecimento está situado. Para fins da Declaração País-a-País, ativos tangíveis não incluem caixa ou itens equivalentes de caixa, intangíveis ou ativos financeiros. Observação: Esse campo deve ser preenchido somente se W100.TIP_MOEDA for diferente de Real.","NS","19","2","-","Não"
"W200","390","20","VL_ATIV_TANG","Ativos Tangíveis (exceto caixa e equivalentes de caixa): Deve ser informada a soma do valor contábil líquido dos ativos tangíveis, em reais, de todas as entidades integrantes do grupo multinacional residentes para fins tributários na jurisdição indicada. Quanto aos estabelecimentos permanentes, seus ativos devem ser reportados com referência à jurisdição na qual o estabelecimento está situado. Para fins da Declaração País-a-País, ativos tangíveis não incluem caixa ou itens equivalentes de caixa, intangíveis ou ativos financeiros. Observação: Caso o campo W200.VL_ATIV_TANG_EST seja informado, este campo será calculado pelo sistema, utilizando como base para conversão tabela do Banco Central para a data de 31 de dezembro do ano da Declaração.","NS","19","2","-","Sim"
"W200","391","21","NUM_EMP","Número de Empregados: Deve ser informado o número total de empregados, trabalhadores e demais colaboradores de todas as entidades integrantes do grupo multinacional residentes para fins tributários na jurisdição indicada. O número de empregados deve ser totalizado ao final do ano, e reportado com base na média registrada para o ano ou outro critério aplicado de maneira consistente entre as jurisdições do grupo e para todos os anos. Para fins da Declaração País- a-País, profissionais independentes contratados participantes das atividades operacionais ordinárias da entidade integrante devem ser reportados como empregados. Arredondamentos ou aproximações razoáveis do número de empregados são permitidas, desde que não gerem distorções relevantes à distribuição relativa de empregados entre as diversas jurisdições tributárias onde o grupo opera. Critérios consistentes devem ser aplicados de um ano para outro entre as entidades.","N","7","2","-","Sim"
"W250","396","1","REG","Texto Fixo Contendo a Identificação do Registro (W250).","C","4","-","[W250]","Sim"
"W250","396","2","JUR_DIFERENTE","Jurisdição Tributária de Organização ou Incorporação, se diferente da jurisdição de residência para fins tributários, conforme tabela do Sped (Disponibilizada no programa da ECF no diretório Arquivos de Programas/Programas Sped/ECf/SpedEcf/Recursos/Tabelas): A entidade declarante deve informar a jurisdição sob cuja legislação a entidade integrante do grupo multinacional está estabelecida, se diferente da jurisdição de residência para fins tributários.","C","2","-","-","Não"
"W250","396","3","NOME","Nome/Razão Social da Entidade Integrante: Nome legal completo da entidade, incluindo a designação doméstica da forma legal, conforme indicado em seus documentos de constituição ou similares. Caso a entidade seja um estabelecimento permanente, deverá ser reportada com referência à jurisdição onde está situada, e seu nome deve ser seguido por (P.E.), designação que significa, em inglês, “Permanent Establishment” (Estabelecimento Permanente). Além disso, deve ser indicada a entidade legal ao qual o estabelecimento permanente está relacionado. Exemplo: ABC P.E. (XYZ Ltda – China)","C","-","-","-","Sim"
"W250","397","4","TIN","Tax Identification Number (TIN): Número de identificação fiscal utilizado pela administração tributária da jurisdição de residência para fins tributários da entidade integrante reportada. Caso a entidade integrante reportada possua esse número de identificação, a informação é de fornecimento obrigatório. Para entidades residentes no Brasil, deve ser informado o CNPJ. Observação: Caso não exista o número, deve ser incluída a expressão ""NOTIN"".","C","-","-","-","Sim"
"W250","397","5","JURISDICAO_TIN","Jurisdição de Emissão do TIN, conforme tabela do Sped (Disponibilizada no programa da ECF no diretório Arquivos de Programas/Programas Sped/ECf/SpedEcf/Recursos/Tabelas).","C","2","-","-","Não"
"W250","397","6","NI","Número de Identificação (NI): O campo deve ser preenchido em caso de existência de outro número de identificação da entidade, como um número de registro ou um número de identificação global da entidade (“Global Entity Identification Number” – EIN).","C","-","-","-","Não"
"W250","397","7","JURISDICAO_NI","Jurisdição de Emissão do NI, conforme tabela do Sped (Disponibilizada no programa da ECF no diretório Arquivos de Programas/Programas Sped/ECf/SpedEcf/Recursos/Tabelas). Observação: Caso a jurisdição de emissão do NI não seja conhecida, o campo deve ser deixado em branco.","C","2","-","-","Não"
"W250","397","8","TIPO_NI","Tipo do NI: Deve ser descrito, em texto livre, o tipo do número de identificação (NI) informado no W250.NI. Exemplo: número de identificação global da entidade (“Global Entity Identification Number” – EIN).","C","-","-","-","Não"
"W250","397","9","TIP_END","O Tipo do Endereço: A entidade declarante deve indicar, dentre as opções disponíveis de preenchimento do campo, o tipo do endereço da entidade integrante que está sendo reportada, o qual deverá ser descrito no campo seguinte. ECD302 - Residencial OECD303 - Comercial","C","7","-","[OECD301; OECD302; OECD303; OECD304; OECD305]","Sim"
"W250","397","10","ENDEREÇO","Deve ser fornecido, em texto livre, o endereço completo de residência permanente da entidade integrante reportada.","C","150","-","-","Sim"
"W250","397","11","NUM_TEL","Número de telefone completo da entidade integrante reportada.","C","15","-","-","Não"
"W250","397","12","EMAIL","Endereço de e-mail para contato com a entidade integrante reportada.","C","115","-","-","Não"
"W250","397","13","ATIV_1","Pesquisa e Desenvolvimento: S - Sim N - Não","C","1","-","[S; N]","Sim"
"W250","398","14","ATIV_2","Gestão de Propriedade Intelectual: S - Sim N - Não","C","1","-","[S; N]","Sim"
"W250","398","15","ATIV_3","Compras: S - Sim N - Não","C","1","-","[S; N]","Sim"
"W250","398","16","ATIV_4","Manufatura ou Produção: S - Sim N - Não","C","1","-","[S; N]","Sim"
"W250","398","17","ATIV_5","Vendas, Marketing ou Distribuição: S - Sim N - Não","C","1","-","[S; N]","Sim"
"W250","398","18","ATIV_6","Serviços Administrativos, de Gestão ou de Suporte: S - Sim N - Não","C","1","-","[S; N]","Sim"
"W250","398","19","ATIV_7","Prestação de Serviços a Partes Não Relacionadas: S - Sim N - Não","C","1","-","[S; N]","Sim"
"W250","398","20","ATIV_8","Departamento Financeiro do Grupo: S - Sim N - Não","C","1","-","[S; N]","Sim"
"W250","398","21","ATIV_9","Serviços Financeiros Regulamentados: S - Sim N - Não","C","1","-","[S; N]","Sim"
"W250","398","22","ATIV_10","Seguro: S - Sim N - Não","C","1","-","[S; N]","Sim"
"W250","398","23","ATIV_11","Gestão de Ações e Outros Instrumentos de Capital: S - Sim N - Não","C","1","-","[S; N]","Sim"
"W250","398","24","ATIV_12","Inativa: S - Sim N - Não","C","1","-","[S; N]","Sim"
"W250","399","25","ATIV_13","Outros: S - Sim N - Não","C","1","-","[S; N]","Sim"
"W250","399","26","DESC_OUTROS","C Descrição da Atividade Econômica Desempenhada, no caso de W250.ATIV_13 (Outros) igual a ""Sim"": Campo em texto livre para que a entidade declarante descreva as atividades econômicas desempenhadas pela entidade integrante reportada que não estejam especificadas dentre as opções disponíveis nos campos anteriores. onforme previsto na Instrução Normativa RFB nº 1.681/2016, artigo 9, § 3º, todas as informações em texto livre da Declaração País-a-País deverão ser fornecidas em um único idioma, a ser escolhido pela entidade declarante dentre as opções de português, inglês e espanhol.","C","255","-","-","Não"
"W250","399","27","OBSERVAÇÃO","C Outras Informações: Campo de utilização opcional, para o fornecimento de informações adicionais sobre a entidade reportada. onforme previsto na Instrução Normativa RFB nº 1.681/2016, artigo 9, § 3º, todas as informações em texto livre da Declaração País-a-País deverão ser fornecidas em um único idioma, a ser escolhido pela entidade declarante dentre as opções de português, inglês e espanhol.","C","1000","-","-","Não"
"W300","402","1","REG","Texto Fixo Contendo a Identificação do Registro (W300).","C","4","-","[W300]","Sim"
"W300","402","2","JURISDICAO","Indicação da jurisdição tributária a que se referem as observações adicionais. Código do país, conforme tabela do Sped (Disponibilizada no programa da ECF no diretório Arquivos de Programas/Programas Sped/ECf/SpedEcf/Recursos/Tabelas).","C","-","-","-","Não"
"W300","402","3","IND_REC_NAO_REL","O campo ""Receitas Provenientes de Partes Não Relacionadas"" (W200.VL_REC_NAO_REL) é tratado nestas observações adicionais? S - Sim N - Não","C","1","-","[S; N]","Não"
"W300","402","4","IND_REC_REL","O campo ""Receitas Provenientes de Partes Relacionadas"" (W200.VL_REC_REL) é tratado nestas observações adicionais? S - Sim N - Não","C","1","-","[S; N]","Não"
"W300","403","5","IND_REC_TOTAL","O campo ""Receita Total"" (W200.VL_REC_TOTAL) é tratado nestas observações adicionais? S - Sim N - Não","C","1","-","[S; N]","Não"
"W300","403","6","IND_LUC_PREJ_ANTES_IR","O campo ""Lucro ou Prejuízo antes do IR"" (W200.VL_LUC_PREJ_ANTES_IR) é tratado nestas observações adicionais? S - Sim N - Não","C","1","-","[S; N]","Não"
"W300","403","7","IND_IR_PAGO","O campo ""Imposto de Renda Pago"" (W200.VL_IR_PAGO) é tratado nestas observações adicionais? S - Sim N - Não","C","1","-","[S; N]","Não"
"W300","403","8","IND_IR_DEVIDO","O campo ""Imposto de Renda Devido"" (W200.VL_IR_DEVIDO) é tratado nestas observações adicionais? S - Sim N - Não","C","1","-","[S; N]","Não"
"W300","403","9","IND_CAP_SOC","O campo ""Capital Social"" (W200.VL_CAP_SOC) é tratado nestas observações adicionais? S - Sim N - Não","C","1","-","[S; N]","Não"
"W300","403","10","IND_LUC_ACUM","O campo ""Lucros Acumulados"" (W200.VL_LUC_ACUM) é tratado nestas observações adicionais? S - Sim N - Não","C","1","-","[S; N]","Não"
"W300","403","11","IND_ATIV_TANG","O campo ""Ativos Tangíveis"" (W200.VL_ATIV_TANG) é tratado nestas observações adicionais? S - Sim N - Não","C","1","-","[S; N]","Não"
"W300","403","12","IND_NUM_EMP","O campo ""Número de Empregados"" (W200.NUM_EMP) é tratado nestas observações adicionais? S - Sim N - Não","C","1","-","[S; N]","Não"
"W300","403","13","OBSERVAÇÃO","Observações.","C","4000","-","-","Sim"
"W300","403","14","FIM_OBSERVACAO","Indicador de fim das observações. Texto fixo contendo “W300FIM”.","C","7","-","[W300FIM]","sim"
"W990","405","1","REG","Texto fixo contendo a identificação do registro (W990).","C","4","-","[W990]","Sim"
"W990","405","2","QTD_LIN","Quantidade total de registros do Bloco W.","N","-","-","-","Sim"
"X001","406","1","REG","Texto fixo contendo a identificação do registro (X001).","C","4","-","[X001]","Sim"
"X001","406","2","IND_DAD","Indicador de movimento: 0 – Bloco com dados informados. 1 – Bloco sem dados informados.","N","1","-","[0;1]","Sim"
"X280","407","1","REG","Texto fixo contendo a identificação do registro (X280).","C","4","-","[X280]","Sim"
"X280","408","2","IND_ATIV","Benefício fiscal: 00 – Não preenchido 01 – Isenção 02 – Redução de 100% 03 – Redução de 75% 04 – Redução de 70% 05 – Redução de 50% 06 – Redução de 33,33% 07 – Redução de 25% 08 – Redução de 12,5% 09 – Redução por Reinvestimento Selecionar no campo Benefício Fiscal o tipo de benefício (isenção ou redução do IRPJ) em relação a cada projeto aprovado no órgão competente, conforme lista disponível na Caixa de Combinação. E, para cada projeto aprovado selecionar no campo Projeto se o mesmo corresponde a ""Novo Empreendimento"", ""Modernização"", ""Ampliação"", ""Diversificação"", ""Manutenção de Empreendimento"", ""Prouni"", “Padis” ou “Outros”. I) Isenção: Este tipo de benefício deve ser selecionado pela pessoa jurídica: a) que tenha instalado, ampliado, modernizado ou diversificado empreendimento industrial ou agrícola, nas áreas de atuação da Sudam e da Sudene, até 31 de dezembro de 1997, nos termos da MP nº 1.740-32, de 1999, convalidada pela Lei nº 9.808, de 1999, art. 13; b) que tenham empreendimento industrial ou agrícola decorrente de projeto aprovado ou protocolizado até 14 de novembro de 1997 nas áreas de atuação da Sudam e da Sudene.","C","2","-","[00; 01; 02; 03; 04; 05; 06; 07; 08; 09]","Sim"
"X280","414","3","IND_PROJ","Projeto: 00 – Não preenchido 01 – Novo Empreendimento 02 – Modernização 03 – Ampliação 04 – Diversificação 05 – Manutenção do Empreendimento 06 – Prouni 07 - Padis 08 – Eventos Fifa 09 – Serviços da Fifa (SPE) 10 – Eventos CIO 11 – Serviços do CIO (SPE) 99 – Outros","C","2","-","[00; 01; 02; 03; 04; 05; 06; 07; 08; 09; 10; 11; 99]","Sim"
"X280","414","4","ATO_CONC","Ato Concessório - Natureza e Número: Informar neste campo o número do ato concessório do benefício fiscal. Atenção: No caso de projeto nas áreas de atuação da Sudam e da Sudene, informar neste campo o número do ato da unidade da RFB editado para reconhecimento do direito ao benefício fiscal.","C","30","-","-","Sim"
"X280","414","5","VIG_INI","Prazo de Vigência – Início Informar a data de início de fruição do benefício conforme consignada no Ato Concessório.","D","8","-","-","Sim"
"X280","414","6","VIG_FIM","Prazo de Vigência – Fim Informar a data de encerramento do prazo de fruição do benefício conforme consignada no Ato Concessório.","D","8","-","-","Sim"
"X291","418","1","REG","Texto Fixo Contendo a Identificação do Registro (X291).","C","4","-","[X291]","Sim"
"X291","418","2","CODIGO","Código, conforme tabela dinâmica do Sped (Disponibilizada no item III deste registro e no programa da ECF no diretório Arquivos de Programas/Programas Sped/ECf/SpedEcf/Recursos/Tabelas).","C","6","-","-","Sim"
"X291","418","3","DESCRICAO","Descrição, conforme tabela dinâmica do Sped (Disponibilizada no item III deste registro e no programa da ECF no diretório Arquivos de Programas/Programas Sped/ECf/SpedEcf/Recursos/Tabelas).","C","-","-","-","Não"
"X291","418","4","VALOR","Valor","NS","19","2","-","Não"
"X292","420","1","REG","Texto Fixo Contendo a Identificação do Registro (X292).","C","4","-","[X292]","Sim"
"X292","420","2","CODIGO","Código, conforme tabela dinâmica do Sped (Disponibilizada no item III deste registro e no programa da ECF no diretório Arquivos de Programas/Programas Sped/ECf/SpedEcf/Recursos/Tabelas).","C","6","-","-","Sim"
"X292","420","3","DESCRICAO","Descrição, conforme tabela dinâmica do Sped (Disponibilizada no item III deste registro e no programa da ECF no diretório Arquivos de Programas/Programas Sped/ECf/SpedEcf/Recursos/Tabelas).","C","-","-","-","Não"
"X292","420","4","VALOR","Valor","NS","19","2","-","Não"
"X300","424","1","REG","Texto Fixo Contendo a Identificação do Registro (X300).","C","4","-","[X300]","Sim"
"X300","424","2","NUM_ORDEM","Número de Ordem das Operações","C","-","-","-","Sim"
"X300","424","3","TIP_EXP","Tipo das Exportações: 01 - Bens 02 - Serviços 03 - Direitos 04 - Operações Financeiras 05 - Não Especificadas","N","2","-","[01; 02; 03; 04; 05]","Sim"
"X300","424","4","DESC_EXP","Descrição das Exportações: Agrupar os bens, serviços ou direitos idênticos, descrevendo cada grupo de modo a permitir a sua perfeita identificação, informando elementos, tais como: marca, tipo, modelo, espécie, etc. Obrigatório somente quando TIP_EXP = Bens, Serviços ou Direitos","C","-","-","-","Não"
"X300","425","5","TOT_OPER","E Total das Operações: EXPORTAÇÕES – Bens, Serviços ou Direito Informar, em reais, para cada operação incluída o valor correspondente ao total de transações da mesma natureza realizadas durante o ano-calendário. Atenção: São consideradas transações de mesma natureza aquelas cujos bens, serviços ou direitos negociados apresentem as mesmas especificações no campo ""Descrição"". XPORTAÇÕES – Não Especificadas Informar neste campo o somatório das operações não informadas nos campos referentes às maiores operações, ou se for o caso, a soma do valor excedente a pelo menos 80% do total das exportações, especificadas em X320.TIP_IMP como “01”, “02”, “03” ou “04”, efetuadas no ano-calendário. Obrigatório somente quando TIP_EXP = Bens, Serviços, Direitos ou Não Especificadas.","N","19","2","-","Não"
"X300","425","6","COD_NCM","Código NCM constante do respectivo registro de exportação, quando o tipo de operação for ""Bens"". Obrigatório somente quando TIP_EXP = Bens","N","8","-","-","Não"
"X300","425","7","QTDE","Quantidade: Informar neste campo a quantidade total dos bens da mesma natureza exportados. Obrigatório somente quando TIP_EXP = Bens","N","19","2","-","Não"
"X300","425","8","UNI_MED","Unidade de Medida: Obrigatório somente quando TIP_EXP = Bens Conforme tabela de unidades de medida do Sped. A pessoa jurídica deve selecionar dentre as opções aquela que corresponde à unidade de medida comercial dos bens exportados, tais como: dúzia, grama, litro, metro etc.","C","2","-","[01 até 74]","Não"
"X300","426","9","IND_OPER","Indicador de Operação Sujeita a Arbitramento S - Sim N - Não Obrigatório somente quando TIP_EXP = Bens, Serviços ou Direitos O campo deve ser assinalado, caso o preço médio de venda do bem, serviço ou direito das exportações efetuadas durante o respectivo período de apuração da base de cálculo do imposto de renda, for inferior a noventa por cento do preço médio praticado na venda do mesmo bem, serviço ou direito no mercado brasileiro, durante o mesmo período, em condições de pagamento semelhantes Atenção: Caso a pessoa jurídica não efetue operações de venda no mercado interno, a determinação dos preços médios é efetuada com dados de outras empresas que pratiquem a venda de bens, serviços ou direitos, idênticos ou similares, no mercado interno (§ 2º, art. 20 da Instrução Normativa RFB nº 1.312, de 28 de dezembro de 2012).","C","1","-","[S; N]","Não"
"X300","426","10","TIP_MET","Método: PVE - Preço de Venda nas Exportações PGE - Preço de Venda por Atacado menos Lucro PVV - Preço de Venda a Varejo menos Lucro CAP - Custo de Aquisição/Produção mais Tributos e Lucro PECEX - Preço sob Cotação na Exportação A pessoa jurídica deve assinalar o método utilizado na determinação do ""Preço Parâmetro"": PVEX Método do Preço de Venda nas Exportações (inciso I do § 3º do art. 19 da Lei nº 9.430, de 1996); PGE Método do Preço de Venda por Atacado no País de Destino Diminuído do Lucro (inciso II do § 3º do art. 19 da Lei nº 9.430, de 1996); PVV Método do Preço de Venda a Varejo no País de Destino Diminuído do Lucro (inciso III do § 3º do art. 19 da Lei nº 9.430, de 1996); CAP Método do Custo de Aquisição ou de Produção mais Tributos e Lucro (inciso IV do § 3º da Lei nº 9.430, de 1996). PECEX Preço sob Cotação na Exportação (Art. 19-A da Lei nº 9.430, de 1996, e art. 34, da IN RFB nº 1.312, de 28 de dezembro de 2012).","C","5","-","[PVE; PGE; PVV; CAP; PECEx]","Não"
"X300","427","11","VL_PAR","Preço Parâmetro: A pessoa jurídica deve informar, neste campo o preço médio ponderado de vendas nas exportações dos bens, serviços ou direitos, apurado no ano-calendário, conforme os métodos estabelecidos nos arts.30 a 34 da Instrução Normativa RFB nº 1.312, de 28 de dezembro de 2012. Obrigatório somente quando TIP_EXP = Bens, Serviços ou Direitos","N","19","2","-","Não"
"X300","427","12","VL_PRAT","Preço Patricado: A pessoa jurídica deve informar, neste campo, o preço médio ponderado de venda nas exportações dos bens, serviços ou direitos, praticado no ano-calendário. Obrigatório somente quando TIP_EXP = Bens, Serviços ou Direitos","N","19","2","-","Não"
