"register","index","code","desc","spec_type","length","spec_required","type","required","decimal"
"0000","2","COD_VER","Código da versão do leiaute conforme a tabela 3.1.1.","N","003*","S","int","True",""
"0000","3","TIPO_ESCRIT","Tipo de escrituração: 0 - Original; 1 – Retificadora.","N","001*","S","int","True",""
"0000","4","IND_SIT_ESP","Indicador de situação especial: 0 - Abertura 1 - Cisão 2 - Fusão 3 - Incorporação 4 – Encerramento","N","001*","N","int","False",""
"0000","5","NUM_REC_ANTERIOR","Número do Recibo da Escrituração anterior a ser retificada, utilizado quando TIPO_ESCRIT for igual a 1","C","041*","N","char","False",""
"0000","6","DT_INI","Data inicial das informações contidas no arquivo.","N","008*","S","date","True",""
"0000","7","DT_FIN","Data final das informações contidas no arquivo.","N","008*","S","date","True",""
"0000","8","NOME","Nome empresarial da pessoa jurídica","C","100","S","char","True",""
"0000","9","CNPJ","Número de inscrição do estabelecimento matriz da pessoa jurídica no CNPJ.","N","014*","S","int","True",""
"0000","10","UF","Sigla da Unidade da Federação da pessoa jurídica.","C","002*","S","char","True",""
"0000","11","COD_MUN","Código do município do domicílio fiscal da pessoa jurídica, conforme a tabela IBGE","N","007*","S","int","True",""
"0000","12","SUFRAMA","Inscrição da pessoa jurídica na Suframa","C","009*","N","char","False",""
"0000","13","IND_NAT_PJ","Indicador da natureza da pessoa jurídica: 00 – Pessoa jurídica em geral 01 – Sociedade cooperativa 02 – Entidade sujeita ao PIS/Pasep exclusivamente com base na Folha de Salários","N","002*","N","int","False",""
"0000","14","IND_ATIV","Indicador de tipo de atividade preponderante: 0 – Industrial ou equiparado a industrial; 1 – Prestador de serviços; 2 - Atividade de comércio; 3 – Pessoas jurídicas referidas nos §§ 6º, 8º e 9º do art. 3º da Lei nº 9.718, de 1998; 4 – Atividade imobiliária; 9 – Outros.","N","001","S","int","True",""
"0001","2","IND_MOV","Indicador de movimento: 0 - Bloco com dados informados; 1 – Bloco sem dados informados.","N","001","S","int","True",""
"0035","2","COD_SCP","Identificação da SCP","N","014*","","int","",""
"0035","3","DESC_SCP","Descrição da SCP","C","","","char","",""
"0035","4","INF_COMP","Informação Complementar","C","","","char","",""
"0100","2","NOME","Nome do contabilista.","C","100","S","char","True",""
"0100","3","CPF","Número de inscrição do contabilista no CPF.","N","011*","S","int","True",""
"0100","4","CRC","Número de inscrição do contabilista no Conselho Regional de Contabilidade.","C","015","S","char","True",""
"0100","5","CNPJ","Número de inscrição do escritório de contabilidade no CNPJ, se houver.","N","014*","N","int","False",""
"0100","6","CEP","Código de Endereçamento Postal.","N","008*","N","int","False",""
"0100","7","END","Logradouro e endereço do imóvel.","C","060","N","char","False",""
"0100","8","NUM","Número do imóvel.","C","","N","char","False",""
"0100","9","COMPL","Dados complementares do endereço.","C","060","N","char","False",""
"0100","10","BAIRRO","Bairro em que o imóvel está situado.","C","060","N","char","False",""
"0100","11","FONE","Número do telefone.","C","11","N","char","False",""
"0100","12","FAX","Número do fax.","C","11","N","char","False",""
"0100","13","EMAIL","Endereço do correio eletrônico.","C","","N","char","False",""
"0100","14","COD_MUN","Código do município, conforme tabela IBGE.","N","007*","N","int","False",""
"0110","2","COD_INC_TRIB","Código indicador da incidência tributária no período: 1 – Escrituração de operações com incidência exclusivamente no regime não-cumulativo; 2 – Escrituração de operações com incidência exclusivamente no regime cumulativo; 3 – Escrituração de operações com incidência nos regimes não-cumulativo e cumulativo.","N","001 *","S","int","True",""
"0110","3","IND_APRO_CRED","Código indicador de método de apropriação de créditos comuns, no caso de incidência no regime não-cumulativo (COD_INC_TRIB = 1 ou 3): 1 – Método de Apropriação Direta; 2 – Método de Rateio Proporcional (Receita Bruta)","N","001 *","N","int","False",""
"0110","4","COD_TIPO_CONT","Código indicador do Tipo de Contribuição Apurada no Período 1 – Apuração da Contribuição Exclusivamente a Alíquota Básica 2 – Apuração da Contribuição a Alíquotas Específicas (Diferenciadas e/ou por Unidade de Medida de Produto)","N","001 *","N","int","False",""
"0110","5","IND_REG_CUM","Código indicador do critério de escrituração e apuração adotado, no caso de incidência exclusivamente no regime cumulativo (COD_INC_TRIB = 2), pela pessoa jurídica submetida ao regime de tributação com base no lucro presumido: 1 – Regime de Caixa – Escrituração consolidada (Registro F500); 2 – Regime de Competência - Escrituração consolidada (Registro F550); 9 – Regime de Competência - Escrituração detalhada, com base nos registros dos Blocos “A”, “C”, “D” e “F”.","N","001 *","N","int","False",""
"0111","2","REC_BRU_NCUM_TRIB_MI","Receita Bruta Não-Cumulativa - Tributada no Mercado Interno","N","","S","float","True","02"
"0111","3","REC_BRU_NCUM_NT_MI","Receita Bruta Não-Cumulativa – Não Tributada no Mercado Interno (Vendas com","N","","S","float","True","02"
"0111","4","REC_BRU_NCUM_EXP","Receita Bruta Não-Cumulativa – Exportação","N","","S","float","True","02"
"0111","5","REC_BRU_CUM","Receita Bruta Cumulativa","N","","S","float","True","02"
"0111","6","REC_BRU_TOTAL","Receita Bruta Total","N","","S","float","True","02"
"0120","2","MES_REFER","Mês de referência do ano-calendário da escrituração  sem dados, dispensada da entrega. Campo a ser preenchido no formato “mmaaaa”","C","006*","S","char","True",""
"0120","3","INF_COMP","Informação complementar do registro. No caso de escrituração sem dados, deve ser informado o real motivo dessa situação, conforme indicadores abaixo: 01 - Pessoa jurídica imune ou isenta do IRPJ 02 - Órgãos públicos, autarquias e fundações públicas 03 - Pessoa jurídica inativa 04 - Pessoa jurídica em geral, que não realizou operações geradoras de receitas (tributáveis ou não) ou de créditos 05 - Sociedade em Conta de Participação - SCP, que não realizou operações geradoras de receitas (tributáveis ou não) ou de créditos 06 - Sociedade Cooperativa, que não realizou operações geradoras de receitas (tributáveis ou não) ou de créditos 07 - Escrituração decorrente de incorporação, fusão ou cisão, sem operações geradoras de receitas (tributáveis ou não) ou de créditos 99 - Demais hipóteses de dispensa de escrituração, relacionadas no art. 5º, da IN RFB nº 1.252, de 2012","C","090","S","char","True",""
"0140","2","COD_EST","Código de identificação do estabelecimento","C","060","N","char","False",""
"0140","3","NOME","Nome empresarial do estabelecimento","C","100","S","char","True",""
"0140","4","CNPJ","Número de inscrição do estabelecimento no CNPJ.","N","014*","S","int","True",""
"0140","5","UF","Sigla da unidade da federação do estabelecimento.","C","002*","S","char","True",""
"0140","6","IE","Inscrição Estadual do estabelecimento, se contribuinte de ICMS.","C","014","N","char","False",""
"0140","7","COD_MUN","Código do município do domicílio fiscal do estabelecimento, conforme a tabela IBGE","N","007*","S","int","True",""
"0140","8","IM","Inscrição Municipal do estabelecimento, se contribuinte do ISS.","C","","N","char","False",""
"0140","9","SUFRAMA","Inscrição do estabelecimento na Suframa","C","009*","N","char","False",""
"0145","2","COD_INC_TRIB","Código indicador da incidência tributária no período: 1 – Contribuição Previdenciária apurada no período, exclusivamente com base na Receita Bruta; 2 – Contribuição Previdenciária apurada no período, com base na Receita Bruta e com base nas Remunerações pagas, na forma dos nos incisos I e III do art. 22 da Lei no 8.212, de 1991.","N","001*","S","int","True",""
"0145","3","VL_REC_TOT","Valor da Receita Bruta Total da Pessoa Jurídica no Período","N","","S","float","True","02"
"0145","4","VL_REC_ATIV","Valor da Receita Bruta da(s) Atividade(s) Sujeita(s) à Contribuição Previdenciária sobre a Receita Bruta","N","","S","float","True","02"
"0145","5","VL_REC_DEMAIS_ATIV","Valor da Receita Bruta da(s) Atividade(s) não Sujeita(s) à Contribuição Previdenciária sobre a Receita Bruta","N","","N","float","False","02"
"0145","6","INFO_COMPL","Informação complementar","C","","N","char","False",""
"0150","2","COD_PART","Código de identificação do participante no arquivo.","C","060","S","char","True",""
"0150","3","NOME","Nome pessoal ou empresarial do participante.","C","100","S","char","True",""
"0190","2","UNID","Código da unidade de medida","C","006","S","char","True",""
"0190","3","DESCR","Descrição da unidade de medida","C","","S","char","True",""
"0200","2","COD_ITEM","Código do item","C","060","S","char","True",""
"0200","3","DESCR_ITEM","Descrição do item","C","","S","char","True",""
"0200","4","COD_BARRA","Representação alfanumérico do código de barra do produto, se houver.","C","","N","char","False",""
"0200","5","COD_ANT_ITEM","Código anterior do item com relação à última informação apresentada.","C","060","N","char","False",""
"0200","6","UNID_INV","Unidade de medida utilizada na quantificação de estoques.","C","006","N","char","False",""
"0200","7","TIPO_ITEM","Tipo do item – Atividades Industriais, Comerciais e Serviços: 00 – Mercadoria para Revenda; 01 – Matéria-Prima; 02 – Embalagem; 03 – Produto em Processo; 04 – Produto Acabado; 05 – Subproduto; 06 – Produto Intermediário; 07 – Material de Uso e Consumo; 08 – Ativo Imobilizado; 09 – Serviços; 10 – Outros insumos; 99 – Outras","N","002*","S","int","True",""
"0200","8","COD_NCM","Código da Nomenclatura Comum do Mercosul","C","008","N","char","False",""
"0200","9","EX_IPI","Código EX, conforme a TIPI","C","003","N","char","False",""
"0200","10","COD_GEN","Código do gênero do item, conforme a Tabela 4.2.1.","N","002*","N","int","False",""
"0200","11","COD_LST","Código do serviço conforme lista do Anexo I da Lei Complementar Federal nº 116/03.","N","004","N","int","False",""
"0200","12","ALIQ_ICMS","Alíquota de ICMS aplicável ao item nas operações internas","N","006","N","float","False","02"
"0205","2","DESCR_ANT_ITEM","Descrição anterior do item","C","","N","char","False",""
"0205","3","DT_INI","Data inicial de utilização da descrição do item","N","008*","S","date","True",""
"0205","4","DT_FIM","Data final de utilização da descrição do item","N","008*","S","date","True",""
"0206","2","COD_COMB","Código do combustível, conforme tabela publicada pela ANP","C","","S","char","True",""
"0208","2","COD_TAB","Código indicador da Tabela de Incidência, conforme Anexo III do Decreto nº 6.707/08: 01 – Tabela I 02 – Tabela II 03 – Tabela III 04 – Tabela IV 05 – Tabela V 06 – Tabela VI 07 – Tabela VII 08– Tabela VIII 09 – Tabela IX 10 – Tabela X 11 – Tabela XI 12 – Tabela XII","","C","","","","002"
"0208","3","COD_GRU","Código do grupo, conforme Anexo III do Decreto nº 6.707/08.","","C","","","","002"
"0208","4","MARCA_COM","Marca Comercial","","C","","","","060"
"0400","2","COD_NAT","Código da natureza da operação/prestação","C","010","S","char","True",""
"0450","2","COD_INF","Código da informação complementar do documento fiscal.","C","006","S","char","True",""
"0450","3","TXT","Texto livre da informação complementar existente no documento fiscal, inclusive espécie de normas legais, poder normativo, número, capitulação, data e demais referências pertinentes com indicação referentes ao tributo.","C","","S","char","True",""
"0500","2","DT_ALT","Data da inclusão/alteração","N","008*","S","date","True",""
"0500","3","COD_NAT_CC","Código da natureza da conta/grupo de contas: 01 - Contas de ativo 02 - Contas de passivo; 03 - Patrimônio líquido; 04 - Contas de resultado; 05 - Contas de compensação; 09 - Outras.","C","002*","S","char","True",""
"0500","4","IND_CTA","Indicador do tipo de conta: S - Sintética (grupo de contas); A - Analítica (conta).","C","001*","S","char","True",""
"0500","5","NÍVEL","Nível da conta analítica/grupo de contas.","N","005","S","int","True",""
"0500","6","COD_CTA","Código da conta analítica/grupo de contas.","C","255","S","char","True",""
"0500","7","NOME_CTA","Nome da conta analítica/grupo de contas.","C","060","S","char","True",""
"0500","8","COD_CTA_REF","Código da conta correlacionada no Plano de Contas Referenciado, publicado pela RFB.","C","060","N","char","False",""
"0500","9","CNPJ_EST","CNPJ do estabelecimento, no caso da conta informada no campo COD_CTA ser específica de um estabelecimento.","N","014*","N","int","False",""
"0600","2","DT_ALT","Data da inclusão/alteração.","N","008*","S","date","True",""
"0600","3","COD_CCUS","Código do centro de custos.","C","255","S","char","True",""
"0600","4","CCUS","Nome do centro de custos.","C","060","S","char","True",""
"0900","2","REC_TOTAL_BLOCO_A","Receita total referente aos registros escriturados no Bloco A","N","","S","float","True","02"
"0900","3","REC_NRB_BLOCO_A","Parcela da receita total escriturada no Bloco A (Campo 02), não classificada como receita bruta","N","","N","float","False","02"
"0900","4","REC_TOTAL_BLOCO_C","Receita total referente aos registros escriturados no Bloco C","N","","S","float","True","02"
"0900","5","REC_NRB_BLOCO_C","Parcela da receita total escriturada no Bloco C (Campo 04), não classificada como receita bruta","N","","N","float","False","02"
"0900","6","REC_TOTAL_BLOCO_D","Receita total referente aos registros escriturados no Bloco D","N","","S","float","True","02"
"0900","7","REC_NRB_BLOCO_D","Parcela da receita total escriturada no Bloco D (Campo 06), não classificada como receita bruta","N","","N","float","False","02"
"0900","8","REC_TOTAL_BLOCO_F","Receita total referente aos registros escriturados no Bloco F","N","","S","float","True","02"
"0900","9","REC_NRB_BLOCO_F","Parcela da receita total escriturada no Bloco F (Campo 08), não classificada como receita bruta","N","","N","float","False","02"
"0900","10","REC_TOTAL_BLOCO_I","Receita total referente aos registros escriturados no Bloco I","N","","S","float","True","02"
"0900","11","REC_NRB_BLOCO_I","Parcela da receita total escriturada no Bloco I (Campo 10) não classificada como receita bruta","N","","N","float","False","02"
"0900","12","REC_TOTAL_BLOCO_1","Receita total referente aos registros escriturados no Bloco 1 (RET)","N","","S","float","True","02"
"0900","13","REC_NRB_BLOCO_1","Parcela da receita total escriturada no Bloco 1 (Campo 12), não classificada como receita bruta","N","","N","float","False","02"
"0900","14","REC_TOTAL_PERIODO","Receita bruta total (Soma dos Campos 02, 04, 06, 08, 10 e 12)","N","","S","float","True","02"
"0900","15","REC_TOTAL_NRB_PERÍODO","Parcela da receita total escriturada (Campo 14), não classificada como receita bruta (Soma dos Campos 03, 05, 07, 09, 11 e 13)","N","","N","float","False","02"
"0990","2","QTD_LIN_0","Quantidade total de linhas do Bloco 0","N","","S","int","True",""
"A001","2","IND_MOV","Indicador de movimento: 0 - Bloco com dados informados; 1 - Bloco sem dados informados","C","001","S","char","True",""
"A010","2","CNPJ","Número de inscrição do estabelecimento no CNPJ.","N","014*","S","int","True",""
"A100","2","IND_OPER","Indicador do tipo de operação: 0 - Serviço Contratado pelo Estabelecimento; 1 - Serviço Prestado pelo Estabelecimento.","C","001*","S","char","True",""
"A100","3","IND_EMIT","Indicador do emitente do documento fiscal: 0 - Emissão Própria; 1 - Emissão de Terceiros","C","001*","S","char","True",""
"A100","4","COD_PART","Código do participante (campo 02 do Registro 0150): - do emitente do documento, no caso de emissão de terceiros; - do adquirente, no caso de serviços prestados.","C","060","N","char","False",""
"A100","5","COD_SIT","Código da situação do documento fiscal: 00 – Documento regular 02 – Documento cancelado","N","002*","S","int","True",""
"A100","6","SER","Série do documento fiscal","C","020","N","char","False",""
"A100","7","SUB","Subsérie do documento fiscal","C","020","N","char","False",""
"A100","8","NUM_DOC","Número do documento fiscal ou documento internacional equivalente","C","060","S","char","True",""
"A100","9","CHV_NFSE","Chave/Código de Verificação da nota fiscal de serviço eletrônica","C","060","N","char","False",""
"A100","10","DT_DOC","Data da emissão do documento fiscal","N","008*","S","date","True",""
"A110","2","COD_INF","Código da informação complementar do documento fiscal (Campo 02 do Registro 0450)","C","006","S","char","True",""
"A110","3","TXT_COMPL","Informação Complementar do Documento Fiscal","C","","N","char","False",""
"A111","2","NUM_PROC","Identificação do processo ou ato concessório","C","015","S","char","True",""
"A111","3","IND_PROC","Indicador da origem do processo: 1 - Justiça Federal; 3 – Secretaria da Receita Federal do Brasil 9 - Outros.","C","001*","S","char","True",""
"A120","2","VL_TOT_SERV","Valor total do serviço, prestado por pessoa física ou jurídica domiciliada no exterior.","N","","S","float","True","02"
"A120","3","VL_BC_PIS","Valor da base de cálculo da Operação – PIS/PASEP – Importação","N","","S","float","True","02"
"A120","4","VL_PIS_IMP","Valor pago/recolhido de PIS/PASEP – Importação","N","","N","float","False","02"
"A120","5","DT_PAG_PIS","Data de pagamento do PIS/PASEP – Importação","N","008 *","N","date","False",""
"A120","6","VL_BC_COFINS","Valor da base de cálculo da Operação – COFINS – Importação","N","","S","float","True","02"
"A120","7","VL_COFINS_IMP","Valor pago/recolhido de COFINS – Importação","N","","N","float","False","02"
"A120","8","DT_PAG_COFINS","Data de pagamento do COFINS – Importação","N","008 *","N","date","False",""
"A120","9","LOC_EXE_SERV","Local da execução do serviço: 0 – Executado no País; 1 – Executado no Exterior, cujo resultado se verifique no País.","C","001 *","S","char","True",""
"A170","2","NUM_ITEM","Número seqüencial do item no documento fiscal","N","004","S","int","True",""
"A170","3","COD_ITEM","Código do item (campo 02 do Registro 0200)","C","060","S","char","True",""
"A170","4","DESCR_COMPL","Descrição complementar do item como adotado no documento fiscal","C","","N","char","False",""
"A170","5","VL_ITEM","Valor total do item (mercadorias ou serviços)","N","","S","float","True","02"
"A170","6","VL_DESC","Valor do desconto comercial / exclusão da base de cálculo do PIS/PASEP e da COFINS","N","","N","float","False","02"
"A170","7","NAT_BC_CRED","Código da base de cálculo do crédito, conforme a Tabela indicada no item 4.3.7, caso seja informado","C","002*","N","char","False",""
"A170","8","IND_ORIG_CRED","Indicador da origem do crédito: 0 – Operação no Mercado Interno 1 – Operação de Importação","C","001*","N","char","False",""
"A170","9","CST_PIS","Código da Situação Tributária referente ao PIS/PASEP – Tabela 4.3.3.","N","002*","S","int","True",""
"A170","10","VL_BC_PIS","Valor da base de cálculo do PIS/PASEP.","N","","N","float","False","02"
"A170","11","ALIQ_PIS","Alíquota do PIS/PASEP (em percentual)","N","","N","float","False","02"
"A170","12","VL_PIS","Valor do PIS/PASEP","N","","N","float","False","02"
"A170","13","CST_COFINS","Código da Situação Tributária referente ao COFINS – Tabela 4.3.4.","N","002*","S","int","True",""
"A170","14","VL_BC_COFINS","Valor da base de cálculo da COFINS","N","","N","float","False","02"
"A170","15","ALIQ_COFINS","Alíquota do COFINS (em percentual)","N","006","N","float","False","02"
"A170","16","VL_COFINS","Valor da COFINS","N","","N","float","False","02"
"A170","17","COD_CTA","Código da conta analítica contábil debitada/creditada","C","255","N","char","False",""
"A170","18","COD_CCUS","Código do centro de custos","C","255","N","char","False",""
"C001","2","IND_MOV","Indicador de movimento: 0 - Bloco com dados informados; 1 - Bloco sem dados informados","C","001*","S","char","True",""
"C010","2","CNPJ","Número de inscrição do estabelecimento no CNPJ.","N","014*","S","int","True",""
"C010","3","IND_ESCRI","Indicador da apuração das contribuições e créditos, na escrituração das operações por NF-e e ECF, no período: 1 – Apuração com base nos registros de consolidação das operações por NF-e (C180 e C190) e por ECF (C490); 2 – Apuração com base no registro individualizado de NF-e (C100 e C170) e de ECF (C400)","C","001*","N","char","False",""
"C100","2","IND_OPER","Indicador do tipo de operação: 0- Entrada; 1- Saída","C","001*","S","char","True",""
"C100","3","IND_EMIT","Indicador do emitente do documento fiscal: 0- Emissão própria; 1- Terceiros","C","001*","S","char","True",""
"C100","4","COD_PART","Código do participante (campo 02 do Registro 0150): - do emitente do documento ou do remetente das mercadorias, no caso de entradas; - do adquirente, no caso de saídas","C","060","S","char","True",""
"C100","5","COD_MOD","Código do modelo do documento fiscal, conforme a Tabela 4.1.1","C","002*","S","char","True",""
"C100","6","COD_SIT;","Código da situação do documento fiscal, conforme a Tabela 4.1.2","N","002*","S","int","True",""
"C100","7","SER","Série do documento fiscal","C","003","N","char","False",""
"C100","8","NUM_DOC","Número do documento fiscal","N","009","S","int","True",""
"C100","9","CHV_NFE","Chave da Nota Fiscal Eletrônica ou da NFC-e","N","044*","N","int","False",""
"C100","10","DT_DOC","Data da emissão do documento fiscal","N","008*","S","date","True",""
"C100","11","DT_E_S","Data da entrada ou da saída","N","008*","N","date","False",""
"C100","12","VL_DOC","Valor total do documento fiscal","N","","S","float","True","02"
"C100","13","IND_PGTO","Indicador do tipo de pagamento: 0- À vista; 1- A prazo; 9- Sem pagamento.","C","001*","S","char","True",""
"C100","14","VL_DESC","Valor total do desconto","N","","N","float","False","02"
"C100","15","VL_ABAT_NT","Abatimento não tributado e não comercial Ex. desconto ICMS nas remessas para ZFM.","N","","N","float","False","02"
"C100","16","VL_MERC","Valor total das mercadorias e serviços","N","","N","float","False","02"
"C100","17","IND_FRT","Indicador do tipo do frete: 0- Por conta de terceiros; 1- Por conta do emitente; 2- Por conta do destinatário; 9- Sem cobrança de frete.","C","001*","S","char","True",""
"C100","18","VL_FRT","Valor do frete indicado no documento fiscal","N","","N","float","False","02"
"C100","19","VL_SEG","Valor do seguro indicado no documento fiscal","N","","N","float","False","02"
"C100","20","VL_OUT_DA","Valor de outras despesas acessórias","N","","N","float","False","02"
"C100","21","VL_BC_ICMS","Valor da base de cálculo do ICMS","N","","N","float","False","02"
"C100","22","VL_ICMS","Valor do ICMS","N","","N","float","False","02"
"C100","23","VL_BC_ICMS_ST","Valor da base de cálculo do ICMS substituição tributária","N","","N","float","False","02"
"C100","24","VL_ICMS_ST","Valor do ICMS retido por substituição tributária","N","","N","float","False","02"
"C100","25","VL_IPI","Valor total do IPI","N","","N","float","False","02"
"C100","26","VL_PIS","Valor total do PIS","N","","N","float","False","02"
"C100","27","VL_COFINS","Valor total da COFINS","N","","N","float","False","02"
"C100","28","VL_PIS_ST","Valor total do PIS retido por substituição tributária","N","","N","float","False","02"
"C100","29","VL_COFINS_ST","Valor total da COFINS retido por substituição tributária","N","","N","float","False","02"
"C110","2","COD_INF","Código da informação complementar do documento fiscal (campo 02 do Registro 0450)","C","006","S","char","True",""
"C110","3","TXT_COMPL","Descrição complementar do código de referência.","C","","N","char","False",""
"C111","2","NUM_PROC","Identificação do processo ou ato concessório","C","020","S","char","True",""
"C111","3","IND_PROC","Indicador da origem do processo: 1 - Justiça Federal; 3 – Secretaria da Receita Federal do Brasil 9 – Outros.","C","001*","S","char","True",""
"C120","2","COD_DOC_IMP","Documento de importação: 0 – Declaração de Importação; 1 – Declaração Simplificada de Importação;","C","001*","S","char","True",""
"C120","3","NUM_DOC_IMP","Número do documento de Importação.","C","015","S","char","True",""
"C120","4","VL_PIS_IMP","Valor pago de PIS na importação","N","","N","float","False","02"
"C120","5","VL_COFINS_IMP","Valor pago de COFINS na importação","N","","N","float","False","02"
"C120","6","NUM_ACDRAW","Número do Ato Concessório do regime Drawback","C","020","N","char","False",""
"C175","2","CFOP","Código fiscal de operação e prestação","N","004*","S","int","True",""
"C175","3","VL_OPR","Valor da operação na combinação de CFOP, CST e alíquotas, correspondente ao somatório do valor das mercadorias e produtos constantes no documento.","N","","S","float","True","02"
"C175","4","VL_DESC","Valor do desconto comercial / exclusão da base de cálculo do PIS/PASEP e da COFINS","N","","N","float","False","02"
"C175","5","CST_PIS","Código da Situação Tributária referente ao PIS/PASEP, conforme a Tabela indicada no item 4.3.3.","N","002*","N","int","False",""
"C175","6","VL_BC_PIS","Valor da base de cálculo do PIS/PASEP (em valor)","N","","N","float","False","02"
"C175","7","ALIQ_PIS","Alíquota do PIS/PASEP (em percentual)","N","008","N","float","False","04"
"C175","8","QUANT_BC_PIS","Base de cálculo PIS/PASEP (em quantidade)","N","","N","float","False","03"
"C175","9","ALIQ_PIS_QUANT","Alíquota do PIS (em reais)","N","","N","float","False","04"
