"K001","197","02","IND_DAD","Indicador de movimento: 0- Bloco com dados informados; 1- Bloco sem dados informados.","N","001","-","[0,1]","Sim","-"
"K030","198","01","REG","Texto fixo contendo “K030”.","C","004","-","“K030”","Sim","-"
"K030","198","02","DT_INI","Data inicial do período consolidado.","N","008","-","-","Sim","-"
"K030","198","03","DT_FIN","Data final do período consolidado.","N","008","-","-","Sim","[ [ [REGRA_DATA_MAIOR_INICIAL _CONS] REGRA_IGUAL_DT_FIN _REG0000] REGRA_PERIODO_CONS]"
"K100","200","01","REG","Texto fixo contendo “K100”.","C","004","-","“K100”","Sim","-"
"K100","200","02","COD_PAIS","Código do país da empresa, conforme tabela do Banco Central do Brasil.","N","005","-","Tabela externa PAIS_SISCOMEX","Sim","[REGRA_TABELA _PAISES]"
"K100","200","03","EMP_COD","Código de identificação da empresa participante.","N","004","-","-","Sim","-"
"K100","200","04","CNPJ","CNPJ (somente os 8 primeiros dígitos).","N","008","-","-","Não","[REGRA_OBRIGATORIO_ CNPJ_BRASIL]"
"K100","200","05","NOME","Nome empresarial.","C","-","-","-","Sim",""
"K100","200","06","PER_PART","Percentual de participação total do conglomerado na empresa no final do período consolidado. Observação: Neste campo, deve ser informado o percentual de participação acionária da empresa titular da ECD.","N","008","004","-","Sim","[ [REGRA_PERC_MENOR _IGUAL_100] REGRA_MAIOR_IGUAL_ _ZERO]"
"K100","201","07","EVENTO","Evento societário ocorrido no período: S - Sim N – Não","C","001","-","[S;N]","Sim","-"
"K100","201","08","PER_CONS","Percentual de consolidação da empresa no final do período consolidado: Informar o percentual do resultado da empresa que foi para a consolidação.","N","008","004","-","Sim","[ [REGRA_PERC_MENOR _IGUAL_100] REGRA_MAIOR_IGUAL _ZERO]"
"K100","201","09","DATA_INI_EMP","Data inicial do período da escrituração contábil da empresa que foi consolidada.","N","008","-","-","Sim","[ [REGRA_CONSOLIDADA_ INICIO_DIFERENTE] REGRA_ANO_IGUAL_ _ANTERIOR_K030]"
"K100","201","10","DATA_FIN_EMP","Data final do período da escrituração contábil da empresa que foi consolidada","N","008","-","-","Sim","[ [ [ [REGRA_DATA_FIN_ MAIOR_IGUAL] REGRA_CONSOLIDADA_ FINAL_DIFERENTE] REGRA_PERIODO_CONS] REGRA_ANO_IGUAL_ _ANTERIOR_K030]"
"K110","204","01","REG","Texto fixo contendo “K110”.","C","004","-","“K110”","Sim","-"
"K110","204","02","EVENTO","Evento societário ocorrido no período: 1 – Aquisição 2 – Alienação 3 – Fusão 4 – Cisão Parcial 5 – Cisão Total 6 – Incorporação 7 – Extinção 8 – Constituição","N","001","-","[1;2;3;4;5;6;7;8]","Sim","-"
"K110","204","03","DT_EVENTO","Data do evento societário.","N","008","-","-","Sim","[REGRA_ANO_IGUAL_ ANTERIOR_POSTERIOR_ K030]"
"K115","206","01","REG","Texto fixo contendo “K115”.","C","004","-","“K115”","Sim","-"
"K115","206","02","EMP_COD_PART","Código da empresa envolvida na operação","N","004","-","-","Sim","[REGRA_EXISTE_EMP_COD_ K100]"
"K115","206","03","COND_PART","Condição da empresa relacionada à operação: 1 – Sucessora; 2 – Adquirente; 3 – Alienante.","N","001","-","[1;2;3]","Sim","[REGRA_CONDICAO_COMPA TIVEL]"
"K115","206","04","PER_EVT","Percentual da empresa participante envolvida na operação","N","008","004","-","Sim","[REGRA_PERC_MENOR_IGUA L_100]"
"K200","208","01","REG","Texto fixo contendo “K200”.","C","004","-","“K200”","Sim","-"
"K200","208","02","COD_NAT","Código da natureza da conta/grupo de contas, conforme tabela publicada pelo Sped.","C","002","-","-","Sim","[REGRA_TABELA_NATUREZ A]"
"K200","208","03","IND_CTA","Indicador do tipo de conta: S - Sintética (grupo de contas); A - Analítica (conta).","C","001","-","[S;A]","Sim","-"
"K200","208","04","NIVEL","Nível da conta","N","-","-","-","Sim","[ [REGRA_MAIOR_QUE_UM] REGRA_ANALITICA_NIVEL_ 2]"
"K200","208","05","COD_CTA","Código da conta","C","-","-","-","Sim",""
"K200","208","06","COD_CTA_SUP","Código da conta superior","C","-","-","-","Não","[ [ [REGRA_COD_CTA_ SUP_OBRIGATORIO] REGRA_CONTA_SUPERIOR_ NAO_SE_APLICA] REGRA_CTA_CONSOLIDAD A_ DE_NIVEL_SUPERIOR_INVA LIDA]"
"K200","208","07","CTA","Nome da conta","C","-","-","-","Sim",""
"K210","211","01","REG","Texto fixo contendo “K210”.","C","004","-","“K210”","Sim","-"
"K210","211","02","COD_EMP","Código de identificação da empresa participante","N","004","-","-","Sim","[REGRA_EXISTE_EMP_COD_K100]"
"K210","211","03","COD_CTA_EMP","Código da conta da empresa participante","C","-","-","-","Sim",""
"K300","212","01","REG","Texto fixo contendo “K300”.","C","004","-","“K300”","Sim","-"
"K300","212","02","COD_CTA","Código da conta consolidada","C","-","-","-","Sim","[REGRA_EXISTE_K200_ANALITICA]"
"K300","212","03","VAL_AG","Valor absoluto aglutinado","N","019","02","-","Sim","-"
"K300","212","04","IND_VAL_AG","Indicador da situação do valor aglutinado: D – Devedor C – Credor","C","001","-","[D;C]","Sim","-"
"K300","212","05","VAL_EL","Valor absoluto das eliminações","N","019","02","-","Sim","[REGRA_SOMATORIO_ VALOR_ELIMINACOES]"
"K300","212","06","IND_VAL_EL","Indicador da situação do valor eliminado: D – Devedor C – Credor","C","001","-","[D;C]","Sim","-"
"K300","212","07","VAL_CS","Valor absoluto consolidado: VAL_CS = VAL_AG – VAL_EL","N","019","02","-","Sim","[REGRA_CALCULO_ VALOR_CONSOLIDADO]"
"K300","212","08","IND_VAL_CS","Indicador da situação do valor consolidado: D – Devedor C – Credor","C","001","-","[D;C]","Sim","-"
"K310","214","01","REG","Texto fixo contendo “K310”.","C","004","-","“K310”","Sim","-"
"K310","214","02","EMP_COD_PARTE","Código da empresa detentora do valor aglutinado que foi eliminado","N","004","-","-","Sim","[REGRA_EXISTE_EMP_COD_ K100]"
"K310","214","03","VALOR","Parcela do valor eliminado total","N","019","02","-","Sim","[REGRA_SOMATORIO_ VALOR_CONTRAPARTIDA]"
"K310","214","04","IND_VALOR","Indicador da situação do valor eliminado: D – Devedor C – Credor","C","001","-","[D;C]","Sim","-"
"K315","215","01","REG","Texto fixo contendo “K315”.","C","004","-","“K315”","Sim","-"
"K315","215","02","EMP_COD_CONTRA","Código da empresa da contrapartida","N","004","-","-","Sim","[ [REGRA_EXISTE_EMP_ COD_K100] REGRA_EMP_COD_CONTRA_ DIFERENTE_EMP_COD_PARTE]"
"K315","215","03","COD_CONTRA","Código da conta consolidada da contrapartida","C","-","-","-","Sim","[ [REGRA_COD_CTA_DIFERENTE_ COD_CONTRA] REGRA_EXISTE_COD _CTA_K300]"
"K315","215","04","VALOR","Parcela da contrapartida do valor eliminado total","N","019","02","-","Sim","[ [REGRA_MAIOR_QUE_ZERO] REGRA_SOMATORIO_ VALOR_CONTRAPARTIDA]"
"K315","215","05","IND_VALOR","Indicador da situação do valor eliminado: D – Devedor C – Credor","C","001","-","[D;C]","Sim","-"
"K990","217","01","REG","Texto fixo contendo “K990”.","C","004","-","""K990""","Sim","-"
"K990","217","02","QTD_LIN_K","Quantidade total de linhas do Bloco K.","N","-","-","-","Sim","[REGRA_QRD_LIN_ BLOCOK]"
"9001","218","01","REG","Texto fixo contendo “9001”.","C","004","-","“9001”","Sim","-"
"9001","218","02","IND_DAD","Indicador de movimento: 0- Bloco com dados informados; 1- Bloco sem dados informados.","N","001","-","[0,1]","Sim","-"
"9900","219","01","REG","Texto fixo contendo “9900”.","C","4","-","“9900”","Sim","-"
"9900","219","02","REG_BLC","Registro que será totalizado no próximo campo.","C","4","-","Somente tipos de registro previstos para a escrituração contábil digital","Sim","-"
"9900","219","03","QTD_REG_BLC","Total de registros do tipo informado no campo anterior.","N","-","-","-","Sim","[REGRA_QTD_REG _BLC]"
"9990","220","01","REG","Texto fixo contendo “9990”.","C","004","-","""9990""","Sim","-"
"9990","220","02","QTD_LIN_9","Quantidade total de linhas do Bloco 9.","N","-","-","-","Sim","[REGRA_QRD_LIN_ BLOCO9]"
"9999","221","01","REG","Texto fixo contendo “9999”.","C","004","-","""9999""","Sim","-"
"9999","221","02","QTD_LIN","Quantidade total de linhas do arquivo digital.","N","-","-","-","Sim","[REGRA_QTD_LIN_ ARQUIVO]"
"9999","223","03","REGRA_REGISTRO_OBRIGATORIO","Verifica se o tipo de registro é obrigatório, conforme obrigatoriedade definida em cada registro. Erro","","","","","",""
"9999","223","04","REGRA_REGISTRO_NAO_SE_APLICA","Verifica se o tipo de registro se aplica à escrituração, conforme definições do leiaute do arquivo. Erro","","","","","",""
